{
  "schema_version": "1.0",
  "asset_id": "a_uploaded_01",
  "task_id": "t_ppt_only",
  "producer_instance_id": null,
  "kind": "image",
  "role": "user_reference",
  "relative_path": "inputs/original/a_uploaded_01/reference.png",
  "mime_type": "image/png",
  "size_bytes": 2048,
  "sha256": "1c9f9e2f73c6d01f7f4b73f0f522ed29b39b0079da4caf56b6157594d1638971",
  "description": "用户上传的新品照片及文字说明。",
  "created_at": "2026-08-19T16:09:00Z"
}
